{
  "version": "asn-entry-0.1",
  "issuer": {
    "id": "status:example:authority"
  },
  "delivery": "pull",
  "object_type": "permit",
  "object_id": "amp:789",
  "state": "attenuated",
  "reason": "policy-tightened",
  "effect": {
    "mode": "narrow",
    "require_new_permit": false,
    "constraints": {
      "max_amount_usd": 0,
      "max_redelegation_depth": 0,
      "tool_allowlist": [
        "read_file"
      ],
      "approval": {
        "mode": "human_required"
      }
    }
  },
  "last_changed_at": "2026-04-16T23:59:00Z",
  "generated_at": "2026-04-17T00:00:00Z",
  "next_update_at": "2026-04-17T00:30:00Z"
}
